{"artifact_type":"validation-report","inputs":[{"artifact_type":"page-profiles","content_sha256":"cccccccccccccccccccccccccccccccccccccccccccccccccccccccccccccccc"}],"payload":{},"producer":{"configuration":{"mode":"demo"},"name":"synthetic-producer","version":"1.0.0"},"project_id":"project:synthetic-demo","schema_version":1,"sources":[{"path":"inputs/synthetic/a-source.pdf","sha256":"bbbbbbbbbbbbbbbbbbbbbbbbbbbbbbbbbbbbbbbbbbbbbbbbbbbbbbbbbbbbbbbb"},{"path":"inputs/synthetic/z-source.pdf","sha256":"aaaaaaaaaaaaaaaaaaaaaaaaaaaaaaaaaaaaaaaaaaaaaaaaaaaaaaaaaaaaaaaa"}]}
